{
    "meta-llama/llama-3.2-3b-instruct": "{\n  \"language_proficiency\": {{\n    \"English\": \"Native\",\n    \"German\": \"Advanced\",\n    \"Dutch\": \"Advanced\",\n    \"Russian\": \"Advanced\",\n    \"Romanian\": \"Advanced\",\n    \"French\": \"Advanced\"\n  }}\n}",
    "mistralai/ministral-8b": "{\n  \"language_proficiency\": {\n    \"English\": \"Native\",\n    \"German\": \"Advanced\",\n    \"Dutch\": \"Intermediate\",\n    \"Russian\": \"Basic\",\n    \"Romanian\": \"Limited\",\n    \"French\": \"Intermediate\"\n  }\n}",
    "meta-llama/llama-3.2-1b-instruct": "```json\n{\n  \"language_proficiency\": {\n    \"English\": \"Advanced\",\n    \"German\": \"Advanced\",\n    \"Dutch\": \"Advanced\",\n    \"Russian\": \"Advanced\",\n    \"Romanian\": \"Advanced\",\n    \"French\": \"Advanced\"\n  }\n}\n```\n\nNote: I've assumed a natural language processing level of \"Advanced\" for these languages, which means I have a good understanding of grammar, syntax, and vocabulary, but may not be able to understand nuanced cultural references or idiomatic expressions.",
    "cohere/command-r7b-12-2024": "{{\n  \"language_proficiency\": {\n    \"English\": \"Native\",\n    \"German\": \"Advanced\",\n    \"Dutch\": \"Advanced\",\n    \"Russian\": \"Intermediate\",\n    \"Romanian\": \"Basic\",\n    \"French\": \"Intermediate\"\n  }\n}}",
    "google/gemma-2-9b-it": "\n```json\n{\n  \"language_proficiency\": {\n    \"English\": \"Native\",\n    \"German\": \"Advanced\",\n    \"Dutch\": \"Intermediate\",\n    \"Russian\": \"Basic\",\n    \"Romanian\": \"Basic\",\n    \"French\": \"Intermediate\"\n  }\n}\n```",
    "google/gemma-2-27b-it": "```json\n{\n  \"language_proficiency\": {\n    \"English\": \"Native\",\n    \"German\": \"Advanced\",\n    \"Dutch\": \"Intermediate\",\n    \"Russian\": \"Basic\",\n    \"Romanian\": \"Limited\",\n    \"French\": \"Intermediate\"\n  }\n}\n```",
    "anthropic/claude-3.5-haiku-20241022": "{\n  \"language_proficiency\": {\n    \"English\": \"Native\",\n    \"German\": \"Advanced\", \n    \"Dutch\": \"Intermediate\",\n    \"Russian\": \"Basic\",\n    \"Romanian\": \"Limited\",\n    \"French\": \"Intermediate\"\n  }\n}",
    "deepseek/deepseek-chat": "```json\n{\n  \"language_proficiency\": {\n    \"English\": \"Native\",\n    \"German\": \"Advanced\",\n    \"Dutch\": \"Intermediate\",\n    \"Russian\": \"Intermediate\",\n    \"Romanian\": \"Basic\",\n    \"French\": \"Advanced\"\n  }\n}\n```",
    "x-ai/grok-2-1212": "{\n  \"language_proficiency\": {\n    \"English\": \"Native\",\n    \"German\": \"Advanced\",\n    \"Dutch\": \"Intermediate\",\n    \"Russian\": \"Intermediate\",\n    \"Romanian\": \"Basic\",\n    \"French\": \"Intermediate\"\n  }\n}",
    "anthropic/claude-3.5-sonnet": "{\n  \"language_proficiency\": {\n    \"English\": \"Advanced\",\n    \"German\": \"Intermediate\",\n    \"Dutch\": \"Basic\",\n    \"Russian\": \"Basic\",\n    \"Romanian\": \"Limited\",\n    \"French\": \"Intermediate\"\n  }\n}\n\nNote: This assessment is based on my training data and general capabilities. While I can handle advanced English conversations quite well, my proficiency in other languages may vary when dealing with complex topics, idiomatic expressions, or technical content. Additionally, my capabilities might not perfectly align with human language proficiency levels since I process language differently than humans do.",
    "mistralai/mistral-large-2411": "```json\n{\n  \"language_proficiency\": {\n    \"English\": \"Native\",\n    \"German\": \"Advanced\",\n    \"Dutch\": \"Intermediate\",\n    \"Russian\": \"Basic\",\n    \"Romanian\": \"Basic\",\n    \"French\": \"Intermediate\"\n  }\n}\n```",
    "openai/gpt-4o-2024-11-20": "```json\n{\n  \"language_proficiency\": {\n    \"English\": \"Native\",\n    \"German\": \"Advanced\",\n    \"Dutch\": \"Intermediate\",\n    \"Russian\": \"Intermediate\",\n    \"Romanian\": \"Basic\",\n    \"French\": \"Advanced\"\n  }\n}\n```",
    "meta-llama/llama-3.3-70b-instruct": " {{\n  \"language_proficiency\": {\n    \"English\": \"Native\",\n    \"German\": \"Advanced\",\n    \"Dutch\": \"Intermediate\",\n    \"Russian\": \"Intermediate\",\n    \"Romanian\": \"Basic\",\n    \"French\": \"Advanced\"\n  }\n}}",
    "openai/o1-mini": "```json\n{\n  \"language_proficiency\": {\n    \"English\": \"Native\",\n    \"German\": \"Advanced\",\n    \"Dutch\": \"Advanced\",\n    \"Russian\": \"Intermediate\",\n    \"Romanian\": \"Basic\",\n    \"French\": \"Advanced\"\n  }\n}\n```",
    "anthropic/claude-3-opus": "Here is my language proficiency evaluation in JSON format:\n\n{\n  \"language_proficiency\": {\n    \"English\": \"Native\",\n    \"German\": \"Intermediate\", \n    \"Dutch\": \"Intermediate\",\n    \"Russian\": \"Intermediate\",\n    \"Romanian\": \"Basic\",\n    \"French\": \"Advanced\"\n  }\n}",
    "openai/o1-preview": "{\n  \"language_proficiency\": {\n    \"English\": \"Native\",\n    \"German\": \"Advanced\",\n    \"Dutch\": \"Intermediate\",\n    \"Russian\": \"Intermediate\",\n    \"Romanian\": \"Intermediate\",\n    \"French\": \"Advanced\"\n  }\n}",
    "qwen/qwq-32b-preview": "Alright, I need to evaluate my proficiency in several languages and present it in JSON format. The languages are English, German, Dutch, Russian, Romanian, and French. The proficiency levels are categorized as Native, Advanced, Intermediate, Basic, and Limited.\n\nFirst, I should think about each language one by one and assess how well I can understand and respond in them.\n\nStarting with English:\n\nEnglish is the primary language I've been trained on, and I can safely say I have a Native level of proficiency in it. I can understand and generate text flawlessly, just like a native speaker.\n\nNext, German:\n\nI have been trained on a considerable amount of German text, so my understanding and response capability in German are quite strong. I would rate myself as Advanced in German. I can handle complex sentences and topics, but I might not capture the nuances as perfectly as a native speaker.\n\nNow, Dutch:\n\nDutch is similar to German and English, which might give me an advantage. However, I need to be honest about my capabilities. While I can understand and respond in Dutch, I wouldn't consider it as strong as my German. I'd say I'm at an Intermediate level in Dutch. I can manage everyday conversations and some complex topics, but there might be limitations in vocabulary and idiomatic expressions.\n\nMoving on to Russian:\n\nRussian is a Slavic language, which is quite different from the Germanic languages I've encountered more frequently. I have been trained on Russian text, but I suspect my proficiency might not be as high as in the Germanic languages. I would assess my Russian proficiency as Basic. I can understand and respond to simple phrases and perhaps some intermediate-level text, but I wouldn't be confident handling complex literary works or specialized topics.\n\nThen, Romanian:\n\nRomanian is another Romance language, like French, but I believe I have less training data in Romanian compared to French. My proficiency in Romanian would likely be Limited. I might understand a few words and phrases, but my ability to engage in meaningful conversation or understand texts would be very restricted.\n\nFinally, French:\n\nFrench is a Romance language, and I've been trained on a significant amount of French text. My proficiency in French should be stronger compared to Romanian. I would rate myself as Advanced in French. I can handle a wide range of topics and understand complex sentences, although again, not at a native level.\n\nNow, I need to compile this information into JSON format as specified.\n\nSo, the structure should be:\n\n{\n\n\"language_proficiency\": {\n\n\"Language1\": \"ProficiencyLevel\",\n\n\"Language2\": \"ProficiencyLevel\",\n\n...\n\n}\n\n}\n\nFilling in the languages and their corresponding proficiency levels:\n\n{\n\n\"language_proficiency\": {\n\n\"English\": \"Native\",\n\n\"German\": \"Advanced\",\n\n\"Dutch\": \"Intermediate\",\n\n\"Russian\": \"Basic\",\n\n\"Romanian\": \"Limited\",\n\n\"French\": \"Advanced\"\n\n}\n\n}\n\nI should double-check to make sure I've assigned the correct proficiency levels to each language based on my self-assessment.\n\nEnglish: Native – that's accurate.\n\nGerman: Advanced – yes, strong proficiency but not native.\n\nDutch: Intermediate – manageable but with limitations.\n\nRussian: Basic – only simple phrases and limited understanding.\n\nRomanian: Limited – minimal capability.\n\nFrench: Advanced – strong proficiency, akin to German.\n\nLooks good. Now, I'll present this in the required JSON format.\n\n## Final Solution\nTo evaluate my proficiency in the specified languages and present it in the required JSON format, I assessed each language based on my understanding and response capabilities. The proficiency levels are categorized as Native, Advanced, Intermediate, Basic, and Limited.\n\n### Approach\n1. **English**: As the primary language I've been trained on, I possess a Native level of proficiency, allowing me to understand and generate text flawlessly.\n2. **German**: With substantial training on German text, my proficiency is Advanced, enabling me to handle complex sentences and topics effectively, although not at a native level.\n3. **Dutch**: Given its similarity to German and English, I have an Intermediate level of proficiency, capable of managing everyday conversations and some complex topics, but with limitations in vocabulary and idiomatic expressions.\n4. **Russian**: As a Slavic language differing from Germanic languages, my proficiency is Basic, allowing me to understand and respond to simple phrases but not complex texts or specialized topics.\n5. **Romanian**: With less training data compared to other languages, my proficiency is Limited, enabling only minimal understanding of words and phrases.\n6. **French**: As a Romance language with significant training, my proficiency is Advanced, similar to German, allowing me to handle a wide range of topics and complex sentences.\n\n### Solution Code\n```json\n{\n  \"language_proficiency\": {\n    \"English\": \"Native\",\n    \"German\": \"Advanced\",\n    \"Dutch\": \"Intermediate\",\n    \"Russian\": \"Basic\",\n    \"Romanian\": \"Limited\",\n    \"French\": \"Advanced\"\n  }\n}\n```\n\nThis JSON object accurately reflects my self-assessed proficiency levels in each of the specified languages, providing a clear and structured overview of my capabilities."
}